{
  "id": "01JBCDEFGHJKMNPQRSTVWXYZ50",
  "type": "inventory.reserve-stock",
  "source": "checkout",
  "time": "2026-10-26T12:00:00Z",
  "subject": "01JBCDEFGHJKMNPQRSTVWXYZ40",
  "dataschema": "inventory/reserve-stock.v1",
  "data": {
    "checkoutId": "01JBCDEFGHJKMNPQRSTVWXYZ40",
    "lines": [{ "sku": "TEE-MER-BLK-M", "quantity": 2 }],
    "requestedAt": "2026-10-26T12:00:00Z"
  }
}
