{
  "id": "01JBCDEFGHJKMNPQRSTVWXYZ60",
  "type": "inventory.stock-level-changed",
  "source": "inventory",
  "time": "2026-10-26T12:00:00Z",
  "subject": "TEE-MER-BLK-M",
  "dataschema": "inventory/stock-level-changed.v1",
  "data": { "sku": "TEE-MER-BLK-M", "onHand": 10, "reserved": 2, "available": 8, "changedAt": "2026-10-26T12:00:00Z" }
}
