{
  "id": "01JBCDEFGHJKMNPQRSTVWXYZ61",
  "type": "payments.payment-succeeded",
  "source": "payments",
  "time": "2026-10-26T12:00:00Z",
  "subject": "01JBCDEFGHJKMNPQRSTVWXYZ43",
  "dataschema": "payments/payment-succeeded.v1",
  "data": {
    "paymentId": "01JBCDEFGHJKMNPQRSTVWXYZ43",
    "checkoutId": "01JBCDEFGHJKMNPQRSTVWXYZ40",
    "customerId": "01JBCDEFGHJKMNPQRSTVWXYZ11",
    "amount": 5220,
    "currency": "USD",
    "stripePaymentIntentId": "pi_3QabcDEFghiJKL0a1b2c3d4e",
    "succeededAt": "2026-10-26T12:00:00Z"
  }
}
