{
  "id": "01JBCDEFGHJKMNPQRSTVWXYZ54",
  "type": "payments.refund-payment",
  "source": "checkout",
  "time": "2026-10-26T12:00:00Z",
  "subject": "01JBCDEFGHJKMNPQRSTVWXYZ40",
  "dataschema": "payments/refund-payment.v1",
  "data": { "checkoutId": "01JBCDEFGHJKMNPQRSTVWXYZ40", "reason": "order_rejected", "requestedAt": "2026-10-26T12:00:00Z" }
}
