{
  "id": "01JBCDEFGHJKMNPQRSTVWXYZ53",
  "type": "payments.request-payment",
  "source": "checkout",
  "time": "2026-10-26T12:00:00Z",
  "subject": "01JBCDEFGHJKMNPQRSTVWXYZ40",
  "dataschema": "payments/request-payment.v1",
  "data": {
    "checkoutId": "01JBCDEFGHJKMNPQRSTVWXYZ40",
    "customerId": "01JBCDEFGHJKMNPQRSTVWXYZ11",
    "amount": 5220,
    "currency": "USD",
    "paymentMethodId": "pm_card_visa",
    "requestedAt": "2026-10-26T12:00:00Z"
  }
}
