{
  "id": "01JBCDEFGHJKMNPQRSTVWXYZ52",
  "type": "inventory.release-reservation",
  "source": "checkout",
  "time": "2026-10-26T12:00:00Z",
  "subject": "01JBCDEFGHJKMNPQRSTVWXYZ40",
  "dataschema": "inventory/release-reservation.v1",
  "data": { "checkoutId": "01JBCDEFGHJKMNPQRSTVWXYZ40", "requestedAt": "2026-10-26T12:00:00Z" }
}
