{
  "id": "01JBCDEFGHJKMNPQRSTVWXYZ00",
  "type": "platform.pinged",
  "source": "ping",
  "time": "2026-10-26T12:00:00Z",
  "subject": "01JBCDEFGHJKMNPQRSTVWXYZ01",
  "dataschema": "platform/pinged.v1",
  "data": {
    "pingId": "01JBCDEFGHJKMNPQRSTVWXYZ01",
    "message": "hello",
    "requestedAt": "2026-10-26T12:00:00Z"
  }
}
