{
  "id": "01JBCDEFGHJKMNPQRSTVWXYZ59",
  "type": "inventory.reservation-released",
  "source": "inventory",
  "time": "2026-10-26T12:00:00Z",
  "subject": "01JBCDEFGHJKMNPQRSTVWXYZ40",
  "dataschema": "inventory/reservation-released.v1",
  "data": {
    "reservationId": "01JBCDEFGHJKMNPQRSTVWXYZ42",
    "checkoutId": "01JBCDEFGHJKMNPQRSTVWXYZ40",
    "reason": "requested",
    "lines": [{ "sku": "TEE-MER-BLK-M", "quantity": 2 }],
    "releasedAt": "2026-10-26T12:02:00Z"
  }
}
